{
  "id": "flight-tracker",
  "name": "Flight Tracker",
  "author": "fbnlrz",
  "description": "Live flight status, schedule and airborne position for a flight reservation, from AeroDataBox and adsb.fi.",
  "repo": "fbnlrz/trek-track",
  "type": "widget",
  "versions": [
    {
      "version": "1.7.6",
      "gitTag": "v1.7.6",
      "commitSha": "cbbb0f26b043b071c3d19e1839df342337046840",
      "downloadUrl": "https://github.com/fbnlrz/trek-track/releases/download/v1.7.6/plugin.zip",
      "sha256": "f911217b3b9aa97ee90b51991ac886d8e68a2083b9a164f1ab8fac44882ef299",
      "minTrekVersion": "3.3.0",
      "size": 79543,
      "apiVersion": 1,
      "nativeModules": false,
      "publishedAt": "2026-07-16T18:01:27.630Z",
      "signature": "Vmy3J4Sx9Q5YIASfaimuI/bAZ0unRvbZtDzdUK4jseDFzftAO4FemAv6zV8F3BCmDYvcaCq6ZXVy3tErVipEDQ=="
    }
  ],
  "homepage": "https://github.com/fbnlrz/trek-track",
  "authorPublicKey": "DJDfduAyHs2Ja/xhOyMkbCAcreMZZyKuz70PqTyfYM0="
}
