{
  "id": "flight-tracker",
  "name": "Flight Tracker",
  "author": "Acme Travel",
  "description": "Live flight status widget for your trips.",
  "repo": "acme-travel/trek-flight-tracker",
  "homepage": "https://acme.example/flight-tracker",
  "tags": [
    "widget",
    "flights",
    "aviation"
  ],
  "type": "widget",
  "versions": [
    {
      "version": "1.0.0",
      "gitTag": "v1.0.0",
      "commitSha": "0000000000000000000000000000000000000000",
      "downloadUrl": "https://github.com/acme-travel/trek-flight-tracker/releases/download/v1.0.0/plugin.zip",
      "sha256": "0000000000000000000000000000000000000000000000000000000000000000",
      "minTrekVersion": "3.2.0",
      "maxTrekVersion": null,
      "size": 184320,
      "apiVersion": 1,
      "nativeModules": false,
      "operatorEgress": false,
      "publishedAt": "2026-06-18T12:00:00Z",
      "requiredAddons": [
        "budget"
      ],
      "pluginDependencies": [
        {
          "id": "koffi",
          "version": ">=1.0.0 <2.0.0"
        }
      ]
    }
  ]
}
