{
  "id": "trek-x-japan",
  "name": "TREK × Japan",
  "author": "fbnlrz",
  "description": "A collaborative in-trip hub for Japan",
  "repo": "fbnlrz/trek-x-japan",
  "type": "trip-page",
  "versions": [
    {
      "version": "1.0.0",
      "gitTag": "v1.0.0",
      "commitSha": "2fc6d0d5c96411da2c20d52a87a3342ac8f989ad",
      "downloadUrl": "https://github.com/fbnlrz/trek-x-japan/releases/download/v1.0.0/plugin.zip",
      "sha256": "2fa3530fc2811c1ac69aca7678cb9adde76d936655b5fe89c2e8d0e06356576e",
      "minTrekVersion": "3.2.1",
      "size": 54581,
      "apiVersion": 1,
      "nativeModules": false,
      "publishedAt": "2026-07-06T00:14:58.028Z"
    }
  ],
  "homepage": "https://github.com/fbnlrz/trek-x-japan"
}
